{
  "$schema": "http://json-schema.org/draft-07/schema#",
  "title": "CORE Processed Reference Cache v1",
  "description": "Schema for a processed reference cache entry that stores a summary keyed by window fingerprint and may carry source provenance fingerprints.",
  "type": "object",
  "required": ["schema_version", "type", "index_id", "ref_id", "window_fingerprint", "summary_fingerprint", "classification_candidate_fingerprint", "cache_status"],
  "properties": {
    "schema_version": {
      "type": "string",
      "const": "core.processed_reference_cache.v1"
    },
    "type": {
      "type": "string",
      "const": "processed_reference_cache"
    },
    "index_id": {
      "type": "string",
      "minLength": 1
    },
    "ref_id": {
      "type": "string",
      "minLength": 1
    },
    "window_fingerprint": {
      "type": "string",
      "pattern": "^sha256:[0-9a-f]{64}$",
      "description": "Fingerprint of the bounded read window this cache is keyed on."
    },
    "summary_fingerprint": {
      "type": "string",
      "pattern": "^sha256:[0-9a-f]{64}$",
      "description": "Fingerprint of the processed summary content."
    },
    "classification_candidate_fingerprint": {
      "type": "string",
      "pattern": "^sha256:[0-9a-f]{64}$",
      "description": "Fingerprint of the classification candidate that validated this cache entry."
    },
    "source_refs": {
      "type": "array",
      "items": {
        "type": "string",
        "minLength": 1
      },
      "description": "Optional source references used to derive the processed cache entry."
    },
    "source_fingerprints": {
      "type": "array",
      "items": {
        "type": "string",
        "pattern": "^sha256:[0-9a-f]{64}$"
      },
      "description": "Optional provenance fingerprints aligned with source_refs."
    },
    "cache_status": {
      "type": "string",
      "enum": ["fresh", "stale"],
      "description": "Whether the cache is still valid given the current window fingerprint."
    }
  },
  "additionalProperties": false
}
